{
	"$schema": "https://wvw.dev/apps.schema.json",
	"store": {
		"name": "sametcn99's Apps",
		"developer": "sametcn99",
		"tagline": "Bon appétit for apps.",
		"url": "https://apps.sametcc.me",
		"github": "https://github.com/sametcn99"
	},
	"featured": [
		{
			"id": "vitepress-mermaid-renderer",
			"headline": "PLUGIN",
			"title": "Make Mermaid diagrams actually interactive.",
			"subtitle": "VitePress Mermaid Renderer adds zoom, pan, fullscreen, export, and theme-aware rendering to Mermaid blocks in your docs."
		},
		{
			"id": "htwind",
			"headline": "DESKTOP APP",
			"title": "HTML widgets for your Windows desktop.",
			"subtitle": "HTWind turns web widgets and PowerShell helpers into a configurable desktop workspace with live preview and tray integration."
		},
		{
			"id": "booking-calendar",
			"headline": "SELF-HOSTED",
			"title": "Own your booking flow end to end.",
			"subtitle": "Booking Calendar is a self-hosted PWA for appointments, notifications, shareable links, and conflict-safe scheduling."
		},
		{
			"id": "my-stars-atlas",
			"headline": "STATIC SITE",
			"title": "Publish your GitHub stars as an atlas.",
			"subtitle": "My Stars Atlas turns starred repositories into a searchable static catalog with categories, filters, and progressive loading."
		}
	],
	"categories": [
		{
			"id": "web",
			"name": "Web Apps"
		},
		{
			"id": "developer-tools",
			"name": "Developer Tools"
		},
		{
			"id": "cli",
			"name": "CLI Apps"
		},
		{
			"id": "productivity",
			"name": "Productivity"
		}
	],
	"apps": [
		{
			"id": "vitepress-mermaid-renderer",
			"name": "VitePress Mermaid Renderer",
			"subtitle": "Interactive Mermaid diagrams for VitePress docs.",
			"description": "A VitePress plugin that turns Mermaid code blocks into interactive diagrams with export and theme support.",
			"longDescription": "Transform static Mermaid diagrams into interactive visualizations inside VitePress. The plugin adds zooming, panning, fullscreen mode, code copy, theme-aware rendering, and export options for documentation sites that need more than a static SVG.",
			"icon": "https://vitepress-mermaid-renderer.vercel.app/vitepress-logo.png",
			"iconEmoji": "🧜",
			"category": [
				"developer-tools",
				"web"
			],
			"platform": "VitePress",
			"price": "Free",
			"github": "https://github.com/sametcn99/vitepress-mermaid-renderer",
			"homepage": "https://vitepress-mermaid-renderer.vercel.app",
			"language": "TypeScript",
			"stars": 55,
			"forks": 4,
			"developer": "sametcn99",
			"installCommand": "npm install vitepress-mermaid-renderer",
			"requirements": "A VitePress project with Mermaid diagrams",
			"features": [
				"Zoom, pan, and reset controls for complex Mermaid diagrams",
				"Fullscreen mode for distraction-free diagram review",
				"Theme-aware rendering that follows light and dark mode",
				"Export diagrams as SVG, PNG, or JPG"
			],
			"screenshots": [
				"https://opengraph.githubassets.com/1/sametcn99/vitepress-mermaid-renderer"
			]
		},
		{
			"id": "htwind",
			"name": "HTWind",
			"subtitle": "HTML widgets and PowerShell tools for the Windows desktop.",
			"description": "A desktop widget manager that brings HTML widgets, automation, and live editing to Windows.",
			"longDescription": "HTWind is a customizable Windows widget manager built around HTML-based widgets. It supports desktop widgets, PowerShell execution, live preview editing, tray workflows, visibility rules, and persistent widget state so desktop tooling stays practical instead of decorative.",
			"icon": "https://raw.githubusercontent.com/sametcn99/HTWind/refs/heads/main/assets/android-chrome-512x512.png",
			"iconEmoji": "🪟",
			"developer": "sametcn99",
			"downloadUrl": "https://github.com/sametcn99/HTWind/releases/latest",
			"category": [
				"productivity",
				"developer-tools"
			],
			"platform": "Windows",
			"price": "Free",
			"github": "https://github.com/sametcn99/HTWind",
			"homepage": "https://htwind.vercel.app",
			"language": "C#",
			"stars": 6,
			"forks": 0,
			"requirements": "Windows desktop environment",
			"features": [
				"HTML desktop widgets with lock and unlock interaction modes",
				"Built-in PowerShell execution for quick system actions",
				"Live widget editor with hot reload preview",
				"Tray integration and smart fullscreen visibility suppression"
			],
			"screenshots": [
				"https://raw.githubusercontent.com/sametcn99/HTWind/refs/heads/main/assets/app_screenshots/page_home.png",
				"https://raw.githubusercontent.com/sametcn99/HTWind/refs/heads/main/assets/app_screenshots/page_settings.png",
				"https://raw.githubusercontent.com/sametcn99/HTWind/refs/heads/main/assets/app_screenshots/page_about.png"
			]
		},
		{
			"id": "booking-calendar",
			"name": "Booking Calendar",
			"subtitle": "Self-hosted appointment scheduling with PWA support.",
			"description": "A single-admin booking platform with shareable links, notifications, and self-hosted data ownership.",
			"longDescription": "Booking Calendar is a self-hosted PWA for managing appointments without handing scheduling data to a third party. It includes admin scheduling controls, public booking pages, cancellation flows, notifications, webhooks, and SQLite-backed persistence aimed at practical small-scale booking workflows.",
			"icon": "https://booking-calendar-docs.vercel.app/android-chrome-512x512.png",
			"iconEmoji": "📅",
			"category": [
				"web",
				"productivity"
			],
			"platform": "Web",
			"price": "Free",
			"developer": "sametcn99",
			"github": "https://github.com/sametcn99/booking-calendar",
			"homepage": "https://booking-calendar-docs.vercel.app",
			"language": "TypeScript",
			"stars": 9,
			"forks": 1,
			"requirements": "Modern browser or self-hosted deployment",
			"features": [
				"Admin dashboard for slots, appointments, and booking links",
				"Conflict-safe booking flow with overlap prevention",
				"Email, web push, and webhook notification support",
				"Installable PWA backed by self-hosted SQLite storage"
			],
			"screenshots": [
				"https://raw.githubusercontent.com/sametcn99/booking-calendar/refs/heads/main/src/docs/public/screenshots/dashboard/dashboard_monthly.png",
				"https://raw.githubusercontent.com/sametcn99/booking-calendar/refs/heads/main/src/docs/public/screenshots/settings/settings.png",
				"https://raw.githubusercontent.com/sametcn99/booking-calendar/refs/heads/main/src/docs/public/screenshots/planner/planner_all.png",
				"https://raw.githubusercontent.com/sametcn99/booking-calendar/refs/heads/main/src/docs/public/screenshots/appointments/appointments_all.png"
			]
		},
		{
			"id": "gpvblazor",
			"name": "GPVBlazor",
			"subtitle": "Explore GitHub profiles, repos, gists, and star history.",
			"description": "A Blazor-based GitHub profile explorer with analytics, charts, and repository insights.",
			"longDescription": "GPVBlazor is a responsive GitHub profile viewer built with Blazor Server. It combines user search, repository browsing, gist viewing, README previews, star history charts, and profile statistics into a single interface for exploring open-source activity in more depth than the default GitHub profile pages.",
			"icon": "https://gpv.sametcc.me/icons/icon512.png",
			"iconEmoji": "📈",
			"category": [
				"web",
				"developer-tools"
			],
			"platform": "Web",
			"price": "Free",
			"github": "https://github.com/sametcn99/GPVBlazor",
			"homepage": "https://gpv.sametcc.me",
			"language": "C#",
			"stars": 0,
			"forks": 0,
			"developer": "sametcn99",
			"requirements": "Modern browser",
			"features": [
				"Search GitHub users with profile, repo, and gist exploration",
				"Interactive star history and profile statistics visualizations",
				"README preview and repository filtering in one interface",
				"Authentication options to extend GitHub API rate limits"
			],
			"screenshots": [
				"https://opengraph.githubassets.com/1/sametcn99/GPVBlazor"
			]
		},
		{
			"id": "product-planning-copilot",
			"name": "product-planning-copilot",
			"subtitle": "Documentation-first planning system teams can fork and adapt.",
			"description": "A reusable repository template for PRDs, roadmaps, architecture notes, and planning quality gates.",
			"longDescription": "product-planning-copilot is a forkable planning workspace for teams that want a consistent documentation-first process. It ships with project folder templates, requirement IDs, task and risk tracking conventions, reusable Copilot assets, and validation hooks that help planning artifacts stay structured as a project grows.",
			"icon": null,
			"iconEmoji": "🗂️",
			"category": [
				"developer-tools",
				"productivity"
			],
			"platform": "Web",
			"price": "Free",
			"github": "https://github.com/sametcn99/product-planning-copilot",
			"homepage": "https://sametcn99.github.io/product-planning-copilot/",
			"language": "HTML",
			"stars": 0,
			"forks": 0,
			"developer": "sametcn99",
			"installCommand": "git clone https://github.com/sametcn99/product-planning-copilot",
			"requirements": "GitHub repository access and Node.js for validation tooling",
			"features": [
				"Project templates for briefs, PRDs, roadmaps, and architecture notes",
				"Traceable requirement, task, and risk identifiers",
				"Reusable Copilot instructions, prompts, and skill assets",
				"Deterministic validation hook for planning quality gates"
			],
			"screenshots": [
				"https://opengraph.githubassets.com/1/sametcn99/product-planning-copilot"
			]
		},
		{
			"id": "linkedin-hide-viewed-jobs",
			"name": "linkedin-hide-viewed-jobs",
			"subtitle": "Hide or highlight viewed LinkedIn job posts.",
			"description": "A privacy-first userscript that hides or marks viewed jobs across LinkedIn Jobs pages.",